[
  {
    "schema_version": "1.0.0",
    "id": "LESSON-A01",
    "status": "CANDIDATE",
    "created_at": "2026-10-31T00:00:00Z",
    "construction_id": "WEP-C01",
    "kind": "CORE1A",
    "grade_track": "G9_FOUNDATION",
    "taught_direction": "CLASSIFY_FROM_CASE",
    "evidence_ids": [],
    "content_path": "lesson-synthetic.md",
    "physical_demo": "Pull box along floor",
    "qualitative_prediction": "Predict work sign",
    "law_and_conditions": "Dot-product under stated conditions",
    "worked_original_example": "Perpendicular force",
    "guided_practice": "Oblique force",
    "misconception_repair": "Large perpendicular force means zero work",
    "verification_check": "Work sign classification",
    "covered_decisive_moves": [
      "Project force onto displacement"
    ]
  }
]
